{
  "$id": "https://aoa.local/aoa-sdk/schemas/agon-slc-sdk-helper.schema.json",
  "$schema": "https://json-schema.org/draft/2020-12/schema",
  "additionalProperties": false,
  "properties": {
    "allowed_actions": {
      "items": {
        "minLength": 1,
        "type": "string"
      },
      "minItems": 1,
      "type": "array",
      "uniqueItems": true
    },
    "assistant_contestant_allowed": {
      "const": false
    },
    "authority_posture": {
      "const": "non_authority"
    },
    "canonical_status": {
      "enum": [
        "non_canonical_candidate",
        "not_canon",
        "not_applicable"
      ]
    },
    "forbidden_actions": {
      "allOf": [
        {
          "contains": {
            "const": "execute"
          }
        },
        {
          "contains": {
            "const": "mutate"
          }
        },
        {
          "contains": {
            "const": "promote"
          }
        },
        {
          "contains": {
            "const": "schedule"
          }
        }
      ],
      "items": {
        "minLength": 1,
        "type": "string"
      },
      "minItems": 4,
      "type": "array",
      "uniqueItems": true
    },
    "forbidden_effects": {
      "allOf": [
        {
          "contains": {
            "const": "live_verdict_authority"
          }
        },
        {
          "contains": {
            "const": "durable_scar_write"
          }
        },
        {
          "contains": {
            "const": "retention_execution"
          }
        },
        {
          "contains": {
            "const": "rank_mutation"
          }
        },
        {
          "contains": {
            "const": "trust_mutation"
          }
        },
        {
          "contains": {
            "const": "tree_of_sophia_promotion"
          }
        },
        {
          "contains": {
            "const": "kag_promotion"
          }
        },
        {
          "contains": {
            "const": "hidden_scheduler_action"
          }
        },
        {
          "contains": {
            "const": "assistant_contestant_drift"
          }
        },
        {
          "contains": {
            "const": "auto_doctrine_rewrite"
          }
        },
        {
          "contains": {
            "const": "school_authority"
          }
        },
        {
          "contains": {
            "const": "lineage_canonization"
          }
        },
        {
          "contains": {
            "const": "live_campaign_arena"
          }
        }
      ],
      "items": {
        "minLength": 1,
        "type": "string"
      },
      "minItems": 13,
      "type": "array",
      "uniqueItems": true
    },
    "helper_id": {
      "minLength": 1,
      "type": "string"
    },
    "helper_status": {
      "minLength": 1,
      "type": "string"
    },
    "live_protocol": {
      "const": false
    },
    "purpose": {
      "minLength": 1,
      "type": "string"
    },
    "review_status": {
      "const": "candidate_only"
    },
    "runtime_effect": {
      "enum": [
        "none",
        "candidate_only",
        "local_dry_run_candidate_only",
        "local_rehearsal_candidate_only"
      ]
    },
    "stop_lines": {
      "allOf": [
        {
          "contains": {
            "const": "no_live_verdict_authority"
          }
        },
        {
          "contains": {
            "const": "no_durable_scar_write"
          }
        },
        {
          "contains": {
            "const": "no_retention_execution"
          }
        },
        {
          "contains": {
            "const": "no_rank_or_trust_mutation"
          }
        },
        {
          "contains": {
            "const": "no_tree_of_sophia_promotion"
          }
        },
        {
          "contains": {
            "const": "no_kag_promotion"
          }
        },
        {
          "contains": {
            "const": "no_hidden_scheduler_action"
          }
        },
        {
          "contains": {
            "const": "no_assistant_contestant_drift"
          }
        },
        {
          "contains": {
            "const": "no_auto_doctrine_rewrite"
          }
        },
        {
          "contains": {
            "const": "no_school_as_authority"
          }
        },
        {
          "contains": {
            "const": "no_lineage_as_canon"
          }
        },
        {
          "contains": {
            "const": "no_campaign_as_live_arena"
          }
        },
        {
          "contains": {
            "const": "no_center_takeover_of_owner_truth"
          }
        }
      ],
      "items": {
        "minLength": 1,
        "type": "string"
      },
      "minItems": 13,
      "type": "array",
      "uniqueItems": true
    },
    "surface_role": {
      "const": "school_lineage_campaign_review_helpers"
    }
  },
  "required": [
    "allowed_actions",
    "assistant_contestant_allowed",
    "authority_posture",
    "canonical_status",
    "forbidden_actions",
    "forbidden_effects",
    "helper_id",
    "helper_status",
    "live_protocol",
    "purpose",
    "review_status",
    "runtime_effect",
    "stop_lines",
    "surface_role"
  ],
  "title": "agon-slc-sdk-helper.schema.json",
  "type": "object"
}
