{
  "allowed_actions": [
    "load",
    "draft",
    "validate",
    "export",
    "inspect"
  ],
  "assistant_contestant_allowed": false,
  "authority_posture": "non_authority",
  "canonical_status": "not_canon",
  "forbidden_actions": [
    "execute",
    "mutate",
    "promote",
    "schedule"
  ],
  "forbidden_effects": [
    "live_verdict_authority",
    "durable_scar_write",
    "retention_execution",
    "rank_mutation",
    "trust_mutation",
    "tree_of_sophia_promotion",
    "kag_promotion",
    "hidden_scheduler_action",
    "assistant_contestant_drift",
    "auto_doctrine_rewrite",
    "school_authority",
    "lineage_canonization",
    "live_campaign_arena"
  ],
  "helper_id": "agon.sdk.slc.load_registry_candidate",
  "helper_status": "requested_only_candidate",
  "live_protocol": false,
  "purpose": "Load center SLC registry and owner registries.",
  "review_status": "candidate_only",
  "runtime_effect": "none",
  "stop_lines": [
    "no_live_verdict_authority",
    "no_durable_scar_write",
    "no_retention_execution",
    "no_rank_or_trust_mutation",
    "no_tree_of_sophia_promotion",
    "no_kag_promotion",
    "no_hidden_scheduler_action",
    "no_assistant_contestant_drift",
    "no_auto_doctrine_rewrite",
    "no_school_as_authority",
    "no_lineage_as_canon",
    "no_campaign_as_live_arena",
    "no_center_takeover_of_owner_truth"
  ],
  "surface_role": "school_lineage_campaign_review_helpers"
}
